,Fecha,Medio,Título,Resumen,Alcance
947,2025-05-22,Noticias IMER (Sitio),Mexicanos crean tratamiento para el Parkinson a escala nanométrica,La UNAM y la UAM-X buscan desarrollar un dispositivo que a escala nanométrica revolucione el tratamiento del Parkinson directo en el cerebro.,158520
948,2025-05-22,Comunícate Digital PUE (sitio),"Anuncia la Mtra. Alejandra Sánchez González, Presidenta de El Colegio de Puebla A.C., El ""Foro de Ciencia y Gobernanza para el Desarrollo Regional Metropolitano""","Este foro será abierto al público y contará con la conferencia magistral del Gobernador del Estado, Alejandro Armenta Mier, como acto inaugural.",17100
949,2025-05-21,NewsWeek México (Sitio),¿Es la sororidad una estrategia evolutiva? Así lo demuestran las hembras bonobo (el estudio completo),"En el planeta las mujeres no solo se organizan para resistir a la violencia masculina; el concepto de sororidad que alude al apoyo mutuo entre mujeres también se manifiesta en el reino animal. Un ejemplo notable son las hembras bonobo, que se alían para protegerse del dominio y la agresión de los machos.",195866
950,2025-05-21,La Prensa (Sitio),"Tacubaya, una de las zonas más antiguas de la CDMX, escenario de la 12ª Tertulia","Realizada en la Casa del Tiempo de la UAM, revive la historia de Parque Lira y celebra el legado de Luis Barragán",42787
951,2025-05-21,Información Center CDMX (sitio),"¿De la UAM a la Justicia? Mauricio Tortolero, candidato 64","El próximo nombre que se sumará a la boleta morada para las elecciones del Poder Judicial 2025 es el de Mauricio Ricardo III Tortolero, un abogado destacado y egresado de la Universidad Autónoma Metropolitana (UAM), quien se postula como candidato a la Suprema Corte de Justicia de la Nación (SCJN).",31500
952,2025-05-21,ContraRéplica SLP (sitio),Soledad moderniza sistema catastral para entregar trámites en solo dos días,"El Ayuntamiento de Soledad de Graciano Sánchez avanza en una profunda modernización de su sistema catastral, una iniciativa impulsada por instrucción del alcalde Juan Manuel Navarro Muñiz, que permitirá agilizar de manera significativa los trámites notariales. Con esta actualización, se estima que los documentos podrán entregarse en solo uno o dos días hábiles, mejorando sustancialmente la atención a las familias del municipio.",12300
953,2025-05-21,Canal 20 TV TAMP (sitio),La UAT suma 12 medallas en campeonatos nacionales de ANUIES 2025,"« Con el firme respaldo del rector Dámaso Anaya Alvarado, la Universidad Autónoma de Tamaulipas (UAT) ha superado las medallas obtenidas en la Universiada Nacional 2024, al sumar hasta el momento 12 preseas (3 de oro, 3 de plata y 6 de bronce) en los Campeonatos Nacionales ANUIES 2025. «",742
954,2025-05-21,JLA Noticias CDMX (Sitio),UAM abre convocatoria para pase directo a 57 opciones de licenciatura: fechas clave y requisitos,"La Universidad Autónoma Metropolitana lanzó la primera convocatoria de 'Pase UAM', mecanismo a través del cual estudiantes del Colegio de Bachilleres podrán acceder a una oferta de 57 licenciaturas que se imparten en cuatro planteles sin necesidad de presentar examen de admisión.",18200
955,2025-05-21,Imagen Agropecuaria SLP (Sitio),"Calor en CDMX, fenómeno cada vez más extremo","La ola de calor que se registra actualmente en la Ciudad de México obedece a una combinación de factores; uno de los principales es la circulación anticiclónica, que impide la formación de nubes y atrapa el calor en la atmósfera, generando un ambiente seco y con altos índices de radiación, así como la presencia de masas de aire caliente que se desplazan hacia el norte del país, lo que contribuye a la elevación de las temperaturas, explicó la doctora Fabiola Sagrario Sosa Rodríguez, profesora e investigadora de la Universidad Autónoma Metropolitana (UAM).",4000
956,2025-05-21,Generación Universitaria CDMX (sitio),¿Cuándo inician las vacaciones de verano en las universidades?,"Se acerca junio y el verano está cada vez más cerca. Prepara tu traje de baño, el viaje a la playa y mucho protector solar porque las vacaciones ya llegaron.",196200
957,2025-05-21,Milenio (sitio),"Difunden foto del presunto asesino de Ximena Guzmán y José Muñoz, funcionarios de CdMx","El periodista y conductor del programa C4 en Alerta, Carlos Jiménez, reveló el rostro del hombre que presuntamente le disparó a los colaboradores de la jefa de Gobierno de la Ciudad de México, Clara Brugada, sobre la Calzada de Tlalpan, a la altura de la colonia Moderna.",199654
958,2025-05-21,Chilango (sitio),UAM abre convocatoria para pase directo a 57 opciones de licenciatura: fechas clave y requisitos,"La Universidad Autónoma Metropolitana lanzó la primera convocatoria de 'Pase UAM', mecanismo a través del cual estudiantes del Colegio de Bachilleres podrán acceder a una oferta de 57 licenciaturas que se imparten en cuatro planteles sin necesidad de presentar examen de admisión.",114000
959,2025-05-21,Excélsior (Sitio),"Suspenden 12 anuncios en la alcaldía Miguel Hidalgo, CDMX","Doce anuncios de publicidad exterior presuntamente ilegales fueron suspendidos en colonias como Polanco y San Miguel Chapultepec, en la alcaldía Miguel Hidalgo, por las autoridades capitalinas, lo cual fue agradecido por vecinos, activistas y ambientalistas.",19300000
960,2025-05-21,NewsWeek México (Sitio),"No se trata solo de reír': Carmen Ramos defiende un teatro incómodo, humano y necesario","Carmen Ramos no solo actúa, también investiga, cuestiona y transforma desde el escenario. Su interpretación de ""Tola"" en Las partículas de Dios obra dirigida por Karla Cantú y escrita por Luis Ayhllón le permite encarnar una propuesta escénica que rompe lo convencional y se instala con fuerza en el debate social.",195866
961,2025-05-21,Canal 4 N+Foro TV,Jimena Guzmán Cuevas y José Muñoz Vega: funcionarios destacados en la administración pública de la Ciudad de México.,"Jimena Josefina Guzmán Cuevas, de 42 años, fue una destacada funcionaria en la administración pública de la Ciudad de México. Licenciada en sociología por la Universidad Autónoma Metropolitana (UAM) y con una maestría en la misma área por la Escuela de Altos Estudios en Ciencias Sociales de París, Guzmán Cuevas ocupó diversos cargos, incluyendo el de secretaria particular de Clara Brugada durante su gestión en la alcaldía Iztapalapa y posteriormente en la jefatura de gobierno.
 
 José Muñoz Vega, de 40 años, era el coordinador de asesores de la Jefatura de Gobierno. Licenciado en Ciencia Política y Administración Pública, Muñoz Vega había desempeñado roles como asesor público en la Cámara de Diputados y en la entonces Asamblea Legislativa de la Ciudad de México. 
 
 Ambos funcionarios perdieron la vida en un accidente automovilístico, dejando un legado en el servicio público de la capital mexicana.",432000
962,2025-05-21,Close Up SLP (Sitio),MUNICIPIO DE SOLEDAD MODERNIZA Y OPTIMIZA ENTREGA DE TRÁMITES NOTARIALES,"Avanza la transformación digital en favor de la población, para facilitar trámites a la ciudadanía, como parte del cambio a la nueva UAM.",12500
963,2025-05-21,Canal 6 Multimedios,"Deportes, Telediario Mediodía.","- Rayados de Monterrey ha llegado a un acuerdo con el entrenador español Domenech Torrent para que dirija al equipo. Torrent, conocido por su experiencia junto a Josep Guardiola, firmará el contrato el próximo sábado. Se espera que su llegada traiga un aumento salarial y refuerzos para el equipo. Torrent ha tenido un buen desempeño en el fútbol europeo y en el Atlético de San Luis, aunque solicitó más recursos para mejorar el equipo.
 
 - En el ciclismo, un competidor ha mantenido la maglia rosa tras terminar en segundo lugar en la etapa 11 de una carrera de 186 km. Este ciclista, parte del equipo UAM Emirates, mantiene una ventaja de 31 segundos sobre su perseguidor, Ayuso. A pesar de la falta de apoyo financiero desde México, el equipo cuenta con fuertes patrocinadores internacionales. El competidor ha acumulado tres segundos lugares en las etapas, mostrando ser altamente competitivo. Las bicicletas utilizadas son de alta gama y muy costosas, reflejando el nivel de inversión en el deporte.",442055
964,2025-05-21,Excélsior (Sitio),"Nombran Ximena Guzmán a Casa de Cuidados en CDMX, en honor a funcionaria asesinada","La primera Casa de Cuidados de la Ciudad de México (CDMX) se llamará Ximena Guzmán en honor de la secretaria particular de la jefa de Gobierno, Clara Brugada.",19300000
965,2025-05-21,Julio Astillero Youtube,"Análisis sobre el asesinato de dos funcionarios públicos cercanos a la jefa de gobierno de la Ciudad de México, Clara Brugada.","En la mesa de análisis participaron Martha Olivia López, conductora; Federico Bonasso, músico y escritor; Teresa Rodríguez de la Vega, periodista; y Arturo Cano, reportero y cronista de La Jornada.
 
 Martha Olivia López indicó que terminó la conferencia de prensa de la FGJCDMX donde compartieron que el vehículo que utilizaron los responsables del doble asesinato salió hacia el oriente, además de que se solicitó la ayuda de la Fiscalía del Estado de México. Agregó que habría cuatro personas relacionadas y que hasta el momento no hay una hipótesis concluyente sobre el móvil del ataque.
 
 Federico Bonasso comentó que lo sucedido fue un asesinato imperdonable y que es un atentado que conmociona al país. A título personal dijo que el asesinato provoca un shock, pues mencionó conocer a la víctima.
 
 Federico Bonasso dijo que la oposición no ha escatimado en mostrar vileza e insensibilidad al burlarse y plantear hipótesis estúpidas y ofensivas. Añadió que la jefa de gobierno de la CDMX, Clara Brugada, dio muestras de fuerza al asistir al velorio de sus colaboradores.
 
 Se presentó un breve resumen de la conferencia de prensa donde participaron la titular de la FGJCDMX, Bertha Alcalde Luján, y el titular de la SSC, Pablo Vázquez Camacho.
 
 Arturo Cano indicó que se confirmó una de las hipótesis que se planteaban ayer, la cual dice que el ataque fue ejecutado por profesionales, aunque la fiscal de la CDMX indicó que no hay nada concluyente sobre el móvil del crimen.
 
 Teresa Rodríguez de la Vega reflexionó sobre el perfil de Ximena y José, funcionarios asesinados, pues terminaron su formación universitaria pensando que trabajar en el gobierno progresista era de donde se podía hacer algo.
 
 Teresa Rodríguez de la Vega dijo que ya es grave que es plausible pensar se pueda fraguar un plan macabro como el que el móvil del crimen sea para desestabilizar el gobierno de la ciudad.
 
 Martha Olivia López se refirió a los mensajes de odio ejemplificando con lo sucedido con el accidente del Buque Escuela Cuauhtémoc en Estados Unidos.
 
 A: Miguel Ángel Mancera; Felipe Calderón; UAM; Paco Stanley.",485000
966,2025-05-21,Plano Informativo SLP (sitio),Soledad moderniza y optimiza la entrega de trámites notariales,"Soledad de Graciano Sánchez, SLP.- En respuesta a la encomienda del Alcalde Juan Manuel Navarro Muñiz, el Ayuntamiento de Soledad de Graciano Sánchez impulsa una innovadora actualización del sistema catastral que reducirá drásticamente los tiempos de entrega de trámites notariales, logrando que sean entregados en solo uno o dos días hábiles tras su ingreso, mejorando la experiencia de atención para las familias soledenses, garantizando un servicio más rápido, eficiente y cercano a la población.",404200
967,2025-05-21,Demócrata Norte de México (Sitio),Iniciativa para Fovissste: decía todo y no decía nada,Gustavo Leal F.,448
968,2025-05-21,El Siglo de Torreón (sitio),¿Qué promedio necesitas y cuántos lugares hay por el pase UAM?,"El pasado 17 de mayo, la Universidad Autónoma Metropolitana (UAM), publicó la convocatoria al Segundo Proceso de Selección 2025 para que los aspirantes que hayan concluido el nivel medio superior o equivalente, puedan ingresar a la licenciatura.",80000
969,2025-05-21,Campeche en Línea CAMP (sitio),¿Quiénes eran los funcionarios de Brugada asesinados en CDMX?,"Esta mañana, fuentes oficiales informaron el homicidio de Ximena Guzmán y José Muñoz, miembros del equipo de Clara Brugada, jefa de Gobierno capitalino.",4000
970,2025-05-21,Campeche en Línea CAMP (sitio),Iglesia mexicana lamenta homicidio de Ximena y José en CDMX,"La Arquidiócesis Primada de México lamentó el fallecimiento de Ximena Guzmán y José Muñoz, miembros del equipo de Clara Brugada, jefa de Gobierno.",4000
972,2025-05-21,Ultimas Noticias TAMPS (sitio),La UAT suma 12 medallas en campeonatos nacionales de ANUIES 2025,"Con el firme respaldo del rector Dámaso Anaya Alvarado, la Universidad Autónoma de Tamaulipas (UAT) ha superado las medallas obtenidas en la Universiada Nacional 2024, al sumar hasta el momento 12 preseas (3 de oro, 3 de plata y 6 de bronce) en los Campeonatos Nacionales ANUIES 2025.",15000
974,2025-05-21,24 Horas Puebla PUE (Sitio),Lanzan convocatoria del Pase UAM 2025 para bachilleres,"La Universidad Autónoma Metropolitana (UAM) publicó la convocatoria oficial del Pase UAM 2025, un medio de ingreso directo para estudiantes del Colegio de Bachilleres con buen desempeño académico.",37000
975,2025-05-21,Yucatán al Minuto YUC (sitio),¿Quiénes eran los funcionarios de Brugada asesinados en CDMX?,"Esta mañana, fuentes oficiales informaron el homicidio de Ximena Guzmán y José Muñoz, miembros del equipo de Clara Brugada, jefa de Gobierno capitalino.",15000
976,2025-05-21,Yucatán al Minuto YUC (sitio),Iglesia mexicana lamenta homicidio de Ximena y José en CDMX,"La Arquidiócesis Primada de México lamentó el fallecimiento de Ximena Guzmán y José Muñoz, miembros del equipo de Clara Brugada, jefa de Gobierno.",15000
977,2025-05-21,El Heraldo Aguascalientes AGS (sitio),¿Quienes eran los dos funcionarios atacados en Tlalpan?,"CIUDAD DE MÉXICO: Ximena Guzmán y José Muñoz, los dos funcionarios públicos asesinados esta mañana (martes) en Calzada de Tlalpan, trabajaron desde hace varios años cerca a la Jefa de Gobierno, Clara Brugada, en la Alcaldía Iztapalapa y en la campaña previa al proceso electoral. Estos son sus perfiles.",227300
978,2025-05-21,Diario A Discusión SIN (sitio),"Esta fue la ruta de escape que siguió el asesino de Ximena Guzmán y José Muñoz, colaboradores de Clara Brugada",Las autoridades capitalinas han identificado los pasos clave que siguió el responsable y sus cómplices,22300
979,2025-05-21,Milenio (sitio),Pase directo UAM 2025: ¿Cuántas carreras hay?,"La Universidad Autónoma Metropolitana (UAM) informó a los estudiantes que van en busca de su pase automático, cuál es el proceso que deberán contemplar para su registro , pero también enlistó las carreras que tiene disponibles para elegir la licenciatura que deseas. En MILENIO te decimos cuáles son.",199654
980,2025-05-21,La Jornada BC (sitio),Ximena Guzmán y José Muñoz formaban parte de círculo más cercano de Brugada,Por: La Jornada,97400
981,2025-05-21,TV. Azteca MX (sitio),Este es el tiempo que dura la tinta indeleble de las Elecciones 2025 en Durango y Veracruz,Descubre por qué la marca de la tinta indeleble en el pulgar es clave para garantizar un voto seguro y cuánto dura en la piel.,55000
989,2025-05-21,Maya Comunicación (Sitio),¿Quiénes fueron Ximena Guzmán y José Muñoz? Dos pilares del servicio público en la CDMX.,"Ciudad de México, 21 de mayo de 2025.-Con una vida dedicada al servicio público, Ximena Josefina Guzmán Cuevas y José Muñoz Vega no solo construyeron sólidas trayectorias en la administración gubernamental, sino que también dejaron una profunda huella en la transformación social y política de la Ciudad de México.",12400
990,2025-05-21,Periódico Contacto TAMP (Sitio),La UAT suma 12 medallas en campeonatos ANUIES 2025,"Con el firme respaldo del rector Dámaso Anaya Alvarado, la Universidad Autónoma de Tamaulipas (UAT) ha superado las medallas obtenidas en la Universiada Nacional 2024, al sumar hasta el momento 12 preseas (3 de oro, 3 de plata y 6 de bronce) en los Campeonatos Nacionales ANUIES 2025.",40
992,2025-05-21,Plano Informativo SLP (sitio),¿Quienes eran los dos funcionarios atacados en Tlalpan?,"Ximena Guzmán y José Muñoz, los dos funcionarios públicos asesinados esta mañana en Calzada de Tlalpan, trabajaron desde hace varios años cerca a la Jefa de Gobierno, Clara Brugada, en la Alcaldía Iztapalapa y en la campaña previa al proceso electoral. Estos son sus perfiles.",404200
993,2025-05-21,Metro Noticias MX (Sitio),Quienes eran Ximena Josefina Guzmán Cuevas y José Muñoz Vega,XIMENA JOSEFINA GUZMÁN CUEVAS,7000
996,2025-05-21,El Economista (sitio),Cuatro mexicanos participan en competencia tecnológica en China,"Shenzhen, Cn. Tres estudiantes y un profesor mexicanos participan en el ICT Competition 2025 de Huawei, que se lleva a cabo en la ciudad de Shenzhen, en China.",318000
997,2025-05-21,El Diario de Delicias CHIH (sitio),¿Quienes eran los dos funcionarios atacados en Tlalpan?,"Ximena Guzmán y José Muñoz, los dos funcionarios públicos asesinados esta mañana en Calzada de Tlalpan, trabajaron desde hace varios años cerca a la Jefa de Gobierno, Clara Brugada, en la Alcaldía Iztapalapa y en la campaña previa al proceso electoral. Estos son sus perfiles.",4000
998,2025-05-21,Latinus_us Youtube,"Fallece Ximena Guzmán, secretaria particular de Clara Brugada, a los 42 años; su rol clave en el gabinete de la Ciudad de México y legado en la administración pública","Ximena Guzmán, quien se desempeñaba como secretaria particular de Clara Brugada, jefa de gobierno de la Ciudad de México, falleció a los 42 años. 
 
 Guzmán, licenciada en sociología por la UAM y maestra en la Escuela de Altos Estudios en Ciencias Sociales de París, tenía acceso a reuniones del gabinete de seguridad y manejaba la agenda diaria de Brugada. 
 
 Su labor incluía ser el enlace con los alcaldes de la Ciudad de México, lo que le otorgaba acceso a información delicada. 
 
 José Muñoz, coordinador de asesores en el gobierno de Brugada, también tenía acceso a temas sensibles y ha ocupado diversos cargos en el ámbito político y social. 
 
 Ambos funcionarios dejaron un legado significativo en la administración pública.",1660000
999,2025-05-21,El Economista (sitio),Cuatro mexicanos participan en competencia tecnológica en China,"Shenzhen, Cn. Tres estudiantes y un profesor mexicanos participan en el ICT Competition 2025 de Huawei, que se lleva a cabo en la ciudad de Shenzhen, en China.",318000
1000,2025-05-21,Nota Tamaulipas TAMPS (sitio),ESCUELA PARA BOMBEROS EN NUEVO LAREDO UN HITAZO,AGENDA FRONTERIZA HUMBERTO GUTIERREZ,18600
1001,2025-05-21,La Jornada Zacatecas ZAC (sitio),Lenia Batres promueve en Zacatecas su candidatura a elecciones judiciales,Por: ALEJANDRA CABRAL,67100
1004,2025-05-21,Canal 8.1 Heraldo TV,"En entrevista, Arturo Ávila, diputado de Morena, habló sobre el asesinato de dos funcionarios de la CDMX.","En entrevista, Arturo Ávila, diputado federal de Morena y vocero de esta fracción parlamentaria, expresó su profunda tristeza y condena por el asesinato de dos funcionarios cercanos a la jefa de gobierno de la Ciudad de México, Ximena Guzmán y Pepe Muñoz. Ávila destacó su profesionalismo y dedicación al servicio público, y aseguró que el gobierno está trabajando arduamente para esclarecer los hechos y castigar a los responsables. 
 
 En relación al accidente del buque Cuauhtémoc en Nueva York, Ávila envió sus condolencias a las familias de los cadetes fallecidos y criticó duramente a la oposición por politizar la tragedia. Defendió la integridad de la Marina Armada de México y subrayó que la investigación debe determinar las responsabilidades, exigiendo justicia a través de los canales diplomáticos y consulares. 
 
 Asimismo, Ávila abordó el tema de Gerardo Fernández Noroña, defendiendo la prudencia y evitando la división dentro de Morena. Finalmente, comentó sobre las posibles candidaturas para el gobierno de Aguascalientes en 2027, expresando su esperanza de que Morena gane en ese estado.",624000
1007,2025-05-21,La Región Tamaulipas TAMP (sitio),La UAT suma 12 medallas en campeonatos nacionales de ANUIES 2025,"Ciudad Victoria, Tam., 20 de mayo de 2025..-Con el firme respaldo del rector Dámaso Anaya Alvarado, la Universidad Autónoma de Tamaulipas (UAT) ha superado las medallas obtenidas en la Universiada Nacional 2024, al sumar hasta el momento 12 preseas (3 de oro, 3 de plata y 6 de bronce) en los Campeonatos Nacionales ANUIES 2025.",6540
1009,2025-05-21,Milenio (sitio),Noticias del asesinato de funcionarios de Clara Brugada HOY 21 de mayo: Despiden a Ximena Guzmán y José Muñoz,"La mañana del martes 20 de mayo, Ximena Guzmán y José Muñoz, secretaria y asesor de la jefa de Gobierno de la Ciudad de México, Clara Brugada, fueron asesinados a balazos en un ataque directo en calzada de Tlalpan.",199654
1018,2025-05-21,Diario Chihuahua (Sitio),¿Quienes eran los dos funcionarios atacados en Tlalpan?,"Ximena Guzmán y José Muñoz, los dos funcionarios públicos asesinados esta mañana en Calzada de Tlalpan, trabajaron desde hace varios años cerca a la Jefa de Gobierno, Clara Brugada, en la Alcaldía Iztapalapa y en la campaña previa al proceso electoral. Estos son sus perfiles.",348000
1023,2025-05-21,Cosmopolítico EDO.MEX (Sitio),Gobierno de la CDMX lamenta mucho el asesinato de Ximena Guzmán y de José Muñoz,Por Martín Aguilar/,4000
1024,2025-05-21,Infobae América (Sitio),"Vecino de la colonia Moderna relata cómo asesinaron a Ximena Guzmán y José Muñoz: ""Traían chalecos verdes""","Mientras las autoridades reconstruyen la ruta de escape seguida por los agresores, habitantes de la zona han comenzado a narrar lo que presenciaron la mañana del martes 20 de mayo, en la colonia Moderna, donde ocurrió el ataque que terminó con la vida de Ximena Guzmán y José Muñoz, colaboradores de la Jefa de Gobierno de la Ciudad de México, Clara Brugada.",1120000
1025,2025-05-21,Infobae América (Sitio),"Velan a colaboradores de Clara Brugada; simpatizantes la arropan con consignas: ""¡No estás sola!""","Los cuerpos de Ximena Guzmán Cuevas, secretaria particular de Clara Brugada, jefa de Gobierno de la Ciudad de México, y de José Muñoz Vega, coordinador general de asesores, son velados la noche de este martes en la funeraria Gayosso Sullivan, en la colonia San Rafael, de la alcaldía Cuauhtémoc.",1120000
1026,2025-05-21,Infobae América (Sitio),"Esta fue la ruta de escape que siguió el asesino de Ximena Guzmán y José Muñoz, colaboradores de Clara Brugada","La Fiscalía General de Justicia de la Ciudad de México (FGJCDMX) investiga el asesinato de Ximena Guzmán Cuevas, secretaria particular de la jefa de Gobierno Clara Brugada, y de su asesor José Muñoz Vega. Ambos funcionarios fueron asesinados a balazos la mañana del martes 20 de mayo, en un ataque directo perpetrado en la Calzada de Tlalpan, a la altura de la colonia Moderna, en la alcaldía Benito Juárez.",1120000
