,Fecha,Medio,Título,Resumen,Alcance
350,2025-06-04,Cimac Noticias (Sitio),Emanuela Borzacchiello recibe premio «Laura Ballesteros Sotelo 2025»,"Ciudad de México.- Gracias a su trabajo por investigar los feminicidios y encontrar respuestas a la violencia generalizada que viven las mujeres, Emanuela Borzacchielo recibió el premio «Laura Ballesteros Sotelo» en mayo de 2025, por ello, aquí te traemos un recorrido por su historia y lucha en defensa de las mujeres desde la academia.",108600
351,2025-06-04,Agenda Hidalguense HGO (Sitio),"Hidalgo, primera entidad en resguardar material genético porcino","Tepatitlán de Morelos, Jalisco.-Derivado del proyecto ""Recuperación y Uso Sostenible del Ts'üdi Xirgo del Valle del Mezquital"", el estado de Hidalgo dio un paso histórico en materia de conservación de la biodiversidad, al convirtirse en la primera entidad del país en resguardar material genético porcino.",2770
352,2025-06-04,La Izquierda Diario (Sitio),Carta a estudiantes de la UAEMex en lucha,"En el marco del intento de diferentes asambleas por coordinar un movimiento en diferentes escuelas (como la UNAM, IPN, UAM) en defensa de la educación pública y gratuita, que, entre otras cosas, exige comedores subsidiados y mejoras en la infraestructura, hay quienes vemos un ejemplo en la lucha de la UAEMex que exige democratización.",1300000
353,2025-06-04,Diario de Morelos MOR (sitio),UAEM entre las 10 mejores universidades de México,"La Universidad Autónoma del Estado de Morelos (UAEM) se ubicó entre las diez mejores universidades de México según el AD Scientific Index (Índice Científico Alper-Doger), una herramienta internacional que evalúa el desempeño académico de científicos e instituciones educativas a partir de métricas derivadas de los perfiles públicos de Google Scholar.",19733
354,2025-06-04,Sopitas (sitio),"Ministras y ministros ""casi"" ganadores de la Suprema Corte: Quiénes son y sus trapitos",La lista va desde Lenia Batres hasta el ministro Chicharrón.,2700000
355,2025-06-04,La Crónica de Hoy (sitio),Paulina Cerna Huici ofrece concierto de viola da gamba en la Casa del Tiempo UAM,Presentará un programa dedicado al instrumento barroco de profunda riqueza sonora y gran expresividad,312000
356,2025-06-04,EdoMex 101.3 Ultra,"El Consejo Universitario de la UAM aprobó avances del pliego petitorio del movimiento estudiantil, destacando la gratuidad de la educación y la reforma al estatuto universitario.","El Consejo Universitario de la UAM ha aprobado los avances del pliego petitorio general del movimiento estudiantil, destacando la gratuidad de la educación y la reforma al estatuto universitario, especialmente el artículo 43. 
 
 Se ha acordado estudiar la inaplicabilidad del artículo 43 para quienes integran el movimiento estudiantil, garantizando la no criminalización de las protestas. 
 
 Además, se ha informado sobre la necesidad de realizar una consulta a la comunidad para llevar a cabo una reforma al estatuto, con la presentación inminente de materiales de difusión por parte de las comisiones de Legislación Universitaria y la especial del Programa Legislativo. 
 
 En la sesión permanente, encabezada por el Dr. Isidro Rogel, se confirmó la renuncia de Carlos Eduardo Barrera Díaz como Rector para el periodo 2021-2025, con fecha de renuncia el 13 de mayo. 
 
 Asimismo, se anunció un descuento del 10% en las inscripciones para el periodo otoño 2025, acumulándose al 10% aplicado en primavera 2025, reduciendo así las cuotas escolares en un 20% y avanzando hacia la gratuidad en la educación universitaria. 
 
 Desde 2009, la UAM ha implementado diversas acciones en beneficio de los estudiantes, como el incremento de cuotas de inscripción y servicios como el potrobús.",70000
357,2025-06-04,Capital de México (sitio),Advierten especialistas de UAM sobre toxicidad de cigarrillos electrónicos,"Diversos estudios sobre los componentes de los cigarros electrónicos revelan la presencia de miles de químicos, potencialmente dañinos para la salud de los consumidores, informaron especialistas de la Universidad Autónoma Metropolitana (UAM).",216300
358,2025-06-04,Energy And Commerce (Sitio),IMP y UAM impulsan foro estratégico sobre transición energética en México,"Con el objetivo de fortalecer la colaboración interinstitucional en materia de transición energética, se llevó a cabo el Foro ""UAM-IMP: Hacia un Futuro Energético Nacional Sostenible"", organizado por el Instituto Mexicano del Petróleo (IMP) y la Universidad Autónoma Metropolitana (UAM), dos instituciones clave en el desarrollo científico, tecnológico y académico del país.",22830
361,2025-06-04,98.5 El Heraldo Radio,El Museo Nacional de Antropología será galardonado con el Premio Princesa de Asturias.,"El Museo Nacional de Antropología recibirá el prestigioso Premio Princesa de Asturias, otorgado por la corona española, en reconocimiento a su labor cultural. 
 
 Este anuncio ha generado reacciones mixtas en México, donde algunos sectores critican la decisión. El museo, inaugurado formalmente en 1964, es considerado uno de los recintos culturales más importantes del mundo. 
 
 A pesar de los esfuerzos de algunos gobernadores y entidades privadas por preservar la cultura, el gobierno federal ha recortado presupuestos y cerrado numerosos museos desde el inicio de la administración de Andrés Manuel López Obrador. 
 
 La respuesta del gobierno mexicano al reconocimiento del Museo de Antropología ha sido negativa, sugiriendo que se utilice como una oportunidad para pedir disculpas. 
 
 La situación refleja la lucha constante por el apoyo a la cultura en el país, a pesar de la existencia de destacados museos y recintos culturales.",1400000
363,2025-06-04,DeReporteros (Facebook),https://dereporteros.com/2025/06/03/bebida-simbiotica-antidiabetica-a-base-de-aguamiel-disenan-investigadores-de-la-uam/,https://dereporteros.com/2025/06/03/bebida-simbiotica-antidiabetica-a-base-de-aguamiel-disenan-investigadores-de-la-uam/,1100
364,2025-06-04,Capital21_Tv (YouTube),"Pase UAM, una alianza con el Colegio de Bachilleres para impulsar el acceso universitario","Pase UAM, una alianza con el Colegio de Bachilleres para impulsar el acceso universitario",10000
365,2025-06-04,ES Bolsamanía (Sitio),Prisa cesa a Pepa Bueno como directora de 'El País' y nombra a Jan Martínez Ahrens,Soplan vientos de cambios en Prisa. La compañía ha decidido cesar a Pepa Bueno como directora de 'El País' y ha nombrado a Jan Martínez Ahrens como nuevo responsable del periódico. El relevo ya ha sido comunicado al Comité de Redacción y será sometido a una votación consultiva de la plantilla del diario.,925000
366,2025-06-04,Digital Plural (Sitio),La Universidad Nacional Rosario Castellanos abre sus puertas a miles de estudiantes con licenciaturas gratuitas y sin examen de admisión,"La Universidad Nacional Rosario Castellanos ha lanzado su convocatoria para el ciclo escolar 2025-2026, ofreciendo una oportunidad única para quienes buscan estudiar una licenciatura sin costo alguno. Esta institución, ahora de alcance nacional, permite a estudiantes de todo México acceder a una educación superior de calidad sin necesidad de presentar un examen de ingreso.",70000
368,2025-06-04,MSN Noticias EU (sitio),Morena expande su poder en la Corte Suprema tras elecciones judiciales en México,"El partido gobernante de México, Morena, ganará control de la Corte Suprema tras las primeras elecciones judiciales en el país, que estuvieron marcadas por una baja participación electoral y alegaciones de un intento de apropiación de poder.",1900000
369,2025-06-04,INVDES (Sitio),¿Por qué es tan difícil aprender y entender las matemáticas?,"Millones de jóvenes que cursan y aprueban la enseñanza media, hallan difícil y hasta odioso el aprendizaje y comprensión de las matemáticas elementales. La mayoría de los profesores culpan a los alumnos, a la sociedad o a los padres de familia. Sin embargo, como en casi todo, siempre hay una responsabilidad compartida entre las partes involucradas. Aquí se presentan un breve análisis y algunos resultados aprendidos para superar este problema donde cada parte pueda participar para crear un entorno educativo que facilite la enseñanza y aprendizaje de las matemáticas.",81400
370,2025-06-04,El Economista (sitio),La Gran Carpa,Foca,318000
373,2025-06-04,Europa Press,Oughourlian propone a Jan Martínez Ahrens para sustituir a Pepa Bueno al frente de 'El País',"MADRID, 4 (EUROPA PRESS)",4700000
374,2025-06-04,Hoja de Ruta (Sitio),Secihti instala Grupo Técnico Asesor del Sistema Nacional de Publicaciones Científicas y Humanísticas para fortalecer la difusión y divulgación del conocimiento,"En representación de la secretaria de Ciencia, Humanidades, Tecnología e Innovación (Secihti), Rosaura Ruiz Gutiérrez, la subsecretaria de Ciencia y Humanidades, Violeta Vázquez-Rojas Maldonado, presidió la Reunión de Trabajo del Grupo Técnico Asesor del Sistema Nacional de Publicaciones Científicas y Humanísticas que impulsará el fortalecimiento del ecosistema editorial y promoverá el acceso abierto al conocimiento en México.",67000
375,2025-06-04,Excélsior (Sitio),"CNTE, 'punta de lanza' en beneficio de la burocracia; buscan sumar adeptos","El Colectivo de Docentes Democráticos del Estado de México se pronunció ayer para que la Coordinadora Nacional Trabajadores de la Educación (CENTE) se convierta en la ""punta de lanza"" en la derogación de la Ley del ISSSTE de 2007 y que beneficie a toda la burocracia y no solamente a los maestros.",19300000
379,2025-06-04,El Economista (sitio),La Gran Carpa,Foca,318000
380,2025-06-04,Noticias MVS (Sitio),María Estela Ríos González: ¿Quién es la nueva ministra de la SCJN?,María Estela Ríos González ha tenido una carrera destacada en el ámbito de la abogacía y siendo funcionaria pública con más de cinco décadas ejerciendo su profesión. Ahora busca ser Ministra de la Suprema Corte de Justicia de la Nación (SCJN) en la primera elección judicial que se celebra en México.,558000
381,2025-06-04,Noticias IMER (Sitio),"Él es Hugo Aguilar, el posible futuro presidente de SCJN","Con mayoría de votos, Hugo Aguilar Ortiz podría ser el próximo presidente de la SCJN; tomaría protesta el 1 de septiembre.",158520
383,2025-06-03,Canal 21 Capital 21,"En entrevista, Alma Herrera, rectora de la Universidad Nacional Rosario Castellanos, habló sobre la transformación de la institución.","En entrevista, la doctora Alma Herrera, rectora de la Universidad Nacional Rosario Castellanos, destacó la transformación y expansión de la institución desde su creación como Instituto de Estudios Superiores de la Ciudad de México hasta su reciente conversión en Universidad Nacional. 
 
 La doctora Herrera explicó que esta evolución ha permitido a la universidad ofrecer una mayor cobertura educativa a nivel nacional, manteniendo un modelo híbrido y dual que combina la formación teórica con contextos reales. La universidad actualmente ofrece 35 licenciaturas, cinco especialidades, siete maestrías y tres doctorados, atendiendo a una matrícula de 62,000 estudiantes. La expansión ha sido posible gracias a la colaboración sinérgica de los tres niveles de gobierno y ha permitido a la universidad contribuir a la inclusión educativa y la justicia social.",25000
384,2025-06-03,Canal 21 Capital 21,Estudiantes del Colegio de Bachilleres aplican al nuevo pase UAM para ingresar a la UAM.,"Este martes finaliza el registro de solicitudes de estudiantes del Colegio de Bachilleres para ingresar a la Universidad Autónoma Metropolitana mediante el nuevo pase UAM, diseñado para jóvenes con un historial académico destacado. 
 
 Entre los solicitantes se encuentran Fernanda Pedrosa, de 18 años, estudiante del plantel 10, con un promedio de 9.8. 
 
 Said Martínez, también del plantel 10, aspira a estudiar Ingeniería Bioquímica Industrial, con el objetivo de crear una cadena de producción de insumos de tatuaje biodegradables. 
 
 Sandra, otra solicitante, se propone estudiar Ingeniería Biomédica para mejorar el sector salud en México. 
 
 Más de 11,000 estudiantes del Colegio de Bachilleres cumplen los requisitos para beneficiarse del Pase UAM, que reconoce su trayectoria académica sin exigir una evaluación previa. 
 
 La información fue reportada por Eric Pinto, con imágenes de Jorge Barajas.",25000
385,2025-06-03,Hoja de Ruta (Sitio),"Inscríbete y participa en el ""Concurso Gastronómico Contemporáneo del Nopal y el Maguey""","Podrán participar personas originarias de cualquier alcaldía de la Ciudad de México, con propuestas gastronómicas innovadoras que utilicen productos derivados del nopal y/o el maguey como ingrediente principal, registrándose en https://forms.gle/8RxNEQXtVzNXzLU88 hasta el 3 de junio. Se otorgarán premios en cuatro categorías: Plato fuerte-Cocina tradicional; Plato fuerte-Innovación; Postre-Cocina tradicional, y Postre-Innovación, el jurado evaluará gusto, presentación, textura, aroma y originalidad.",67000
386,2025-06-03,De reporteros CDMX (Sitio),"Bebida simbiótica antidiabética a base de aguamiel, diseñan investigadores de la UAM","* La doctora Alma Elizabeth Cruz Guerrero encabeza un equipo que trabaja en la etapa básica del proyecto, que también busca favorecer a productores de agave",12300
387,2025-06-03,88.1 Universal,"La calidad del agua en la Ciudad de México, un tema pendiente.","La calidad del agua potable en la Ciudad de México, proveniente principalmente del sistema Cutzamala, Lerma y pozos, enfrenta desafíos. 
 
 Luis Manuel Guerra, presidente del Instituto de Asistencia en Investigaciones Ecológicas, destaca variaciones en la calidad, especialmente en el oriente, con pozos cerrados por incumplimiento de la norma 127 de la Secretaría de Salud. 
 
 Roberto Martín Constantino, de la UAM, señala que la mejora en el abastecimiento de agua ha contribuido a aumentar la esperanza de vida, aunque la calidad sigue siendo un problema, especialmente en pozos profundos. 
 
 Ana Cecilia Espinosa García, de la UNAM, enfatiza la importancia del mantenimiento en hogares para garantizar la calidad del agua. 
 
 Organizaciones exigen monitoreos y mantenimiento de redes de distribución, mientras se recomienda el uso de kits de evaluación de pureza del agua.",1404000
388,2025-06-03,EDT Estado del Tiempo MX (sitio),Anuncian concurso gastronómico con nopal y maguey en Monumento a la Revolución,"Ciudad de México.- El próximo domingo 8 de junio, el Monumento a la Revolución será el escenario del Concurso Gastronómico Contemporáneo del Nopal y el Maguey, organizado por la Secretaría del Medio Ambiente (SEDEMA), en colaboración con la Secretaría de Turismo (SECTUR), la Secretaría de Cultura de la Ciudad de México y la alcaldía Milpa Alta. Este evento forma parte de las actividades de la Feria del Nopal 2025, que se celebrará el mismo fin de semana.",10100
389,2025-06-03,El Heraldo de México (sitio),"Metro CDMX: usuario se arroja al paso del tren en la Línea 8, HOY martes 3 de junio","Alrededor de las 14:43 horas de este martes 3 de junio el Servicio de Transporte Colectivo (STC) Metro informó sobre una personas que se habría arrojado a la zona de vías en la estación Santa Anita, perteneciente a la Línea 8 que corre desde Bellas Artes hasta Constitución de 1917.",1674420
390,2025-06-03,Cobertura 360 (sitio),Lirio acuático invade el río Lerma y amenaza su biodiversidad,"Dañino es el lirio acuático para la flora y fauna del río Lerma en San Mateo Atenco porque su presencia ocasiona que los organismos vivos que ahí habitan, no prosperen, explicó el catedrático de la Universidad Autónoma Metropolitana (UAM), unidad Lerma, Aldo Gómez Benítez.",59000
391,2025-06-03,Sinaloa Quadratin SIN (sitio),Diseñan investigadores de la UAM bebida antidiabética a base de aguamiel,"OAXACA, Oax., 3 de junio de 2025.- Un grupo de investigación del Departamento de Biotecnología de la Universidad Autónoma Metropolitana (UAM), liderado por la doctora Alma Elizabeth Cruz Guerrero, trabaja en el diseño de una bebida simbiótica a base de aguamiel, con el propósito de favorecer la salud de las personas que padecen diabetes y contribuir a mejorar la economía de productores de agave.",5000
392,2025-06-03,100.1 Stereo Cien,"Las buenas noticias, Enfoque Noticias Segunda Emisión.","- Un grupo de investigación del departamento de biotecnología de la Universidad Autónoma Metropolitana (UAM) está desarrollando una bebida simbiótica a base de aguamiel, diseñada para ayudar a personas con diabetes. Esta bebida tiene como objetivo promover la depuración de toxinas en el cuerpo y mejorar la absorción de azúcares. 
 
 - En México, casi 12.5 millones de personas tienen diabetes, según la Encuesta Nacional de Salud y Nutrición de 2021. La bebida en desarrollo busca ofrecer una alternativa saludable para estas personas mediante el uso de proteínas y probióticos derivados del aguamiel.
 
 - Además de beneficiar a los diabéticos, el proyecto también apoya a los productores de agave en Hidalgo, Tlaxcala y el Estado de México, quienes han enfrentado dificultades debido a la disminución de las ventas de pulque. El aguamiel, que no se fermenta en este proceso, se convierte en una nueva fuente de ingresos para ellos.",650000
393,2025-06-03,Canal 40 Adn,"Denuncian acoso sexual en la Universidad Bancaria de México, ubicada en el Estado de México.","En un conmovedor testimonio, una madre denuncia el acoso sexual de su hija por parte de un profesor en la Universidad Bancaria de México, situada en Cholul, Estado de México. 
 
 La entrevistada relata la falta de respuesta por parte de las autoridades tras su denuncia, enfrentándose a amenazas y extorsiones. 
 
 La situación se agrava con la revelación de otros casos de abuso y bullying en la institución. 
 
 A pesar de las denuncias, las autoridades escolares han permanecido inactivas. 
 
 La madre hace un llamado a las autoridades correspondientes, incluyendo fiscalías y la Secretaría de Educación, para brindar apoyo y prevenir futuras agresiones. 
 
 La Universidad Bancaria de México ha emitido un comunicado condenando cualquier acto de acoso o violencia. 
 
 Sin embargo, la falta de acción concreta y la presencia de amenazas han generado un clima de temor entre los estudiantes y sus familias. 
 
 La situación plantea interrogantes sobre la eficacia de las autoridades educativas y la necesidad de una respuesta más contundente ante estos casos de abuso.",3780000
394,2025-06-03,EDT Estado del Tiempo MX (sitio),Anuncian concurso gastronómico con nopal y maguey en Monumento a la Revolución,"Ciudad de México.- El próximo domingo 8 de junio, el Monumento a la Revolución será el escenario del Concurso Gastronómico Contemporáneo del Nopal y el Maguey, organizado por la Secretaría del Medio Ambiente (SEDEMA), en colaboración con la Secretaría de Turismo (SECTUR), la Secretaría de Cultura de la Ciudad de México y la alcaldía Milpa Alta. Este evento forma parte de las actividades de la Feria del Nopal 2025, que se celebrará el mismo fin de semana.",10100
397,2025-06-03,Al Momento MX (sitio),Anuncian concurso gastronómico con nopal y maguey en Monumento a la Revolución,"El próximo domingo 8 de junio, el Monumento a la Revolución será el escenario del Concurso Gastronómico Contemporáneo del Nopal y el Maguey, organizado por la Secretaría del Medio Ambiente (SEDEMA), en colaboración con la Secretaría de Turismo (SECTUR), la Secretaría de Cultura de la Ciudad de México y la alcaldía Milpa Alta. Este evento forma parte de las actividades de la Feria del Nopal 2025, que se celebrará el mismo fin de semana.",82600
398,2025-06-03,DiMe News CDMX (sitio),Claudia Sheinbaum en las 100 Mujeres más Poderosas de México 2025,"CIUDAD DE MÉXICO.- ""No llego sola, llegamos todas"", dice la presidenta Claudia Sheinbaum Pardo frente a las mexicanas que dan testimonio de la primera mujer electa en las urnas para conducir el destino de México y quienes guardan la promesa de mejores condiciones para todas las mujeres.",5000
399,2025-06-03,Luces del Siglo QROO (sitio),"En CDMX, avanza 18.94% el cómputo en dos días",El Consejo General del IECM reanudó la sesión extraordinaria sólo para dar a conocer dicho avance en las 33 oficinas distritales.,28600
400,2025-06-03,Animal Político (sitio),México y sus compromisos incumplidos en materia climática,"Las 9 dimensiones de la crisis planetaria
 De acuerdo con los hallazgos del Sexto Informe de Evaluación del Panel Intergubernamental sobre Cambio Climático (IPCC), las actividades humanas son responsables del aumento de las emisiones de dióxido de carbono, lo que ha contribuido significativamente al incremento de la temperatura global. Entre los principales factores se encuentran la mala gestión de los bienes naturales, los cambios en el uso del suelo, así como los patrones insostenibles de consumo y producción.",2600000
401,2025-06-03,Político CDMX (Sitio),(FOTOS) Así podría quedar conformada la Suprema Corte de Justicia,"El pasado 1 de junio se llevaron a cabo las elecciones del Poder Judicial, en la cual se votó por los próximos nueve ministros de la Suprema Corte de Justicia de la Nación (SCJN).",52300
402,2025-06-03,Tierra Fuerte (sitio),"OMSA: uso de antimicrobianos en animales cae 5%, pero RAM podría causar 38 millones de muertes humanas","Un nuevo informe de la Organización Mundial de Sanidad Animal (OMSA) reveló que el uso de antimicrobianos en animales disminuyó 5% entre 2020 y 2022, pero las tendencias muestran que, sin medidas, la resistencia a los antimicrobianos (RAM) podría causar 38,5 millones de muertes humanas entre 2025 y 2050.",40
404,2025-06-03,Publimetro (sitio),"Fallan semáforos de CDMX, en cruceros clave, tras lluvias que colapsaron las calles","Usuarios en redes reportaron semáforos apagados en avenidas como Insurgentes, Periférico, Viaducto, Circuito Interior, Ermita y Nuevo León, sin atención inmediata.",454059
405,2025-06-03,107.9 Horizonte,"En entrevista, Héctor Manuel Villarreal Beltrán, profesor de la UAM, habló sobre la nueva cara de la SCJN.","En entrevista, el doctor Héctor Manuel Villarreal Beltrán, profesor del Departamento de Política y Cultura en la Universidad Autónoma Metropolitana, unidad Xochimilco, compartió su perspectiva sobre la nueva integración de la Suprema Corte de Justicia de la Nación (SCJN) tras los recientes comicios judiciales.
 
 Villarreal Beltrán destacó que la elección de ministros por voto popular es un hecho interesante y poco común a nivel internacional, aunque subrayó la importancia de que la Corte mantenga su autonomía y funcione como un contrapeso efectivo al poder ejecutivo y legislativo. 
 
 Se mostró escéptico sobre si esta nueva composición de la Corte, que incluye a varios ministros con trayectoria política pero poca experiencia judicial, logrará reducir la alta impunidad en México. Considera que la reforma judicial debería haber comenzado por fortalecer la base del sistema judicial con más recursos y personal, en lugar de centrarse en la elección popular de los ministros. 
 
 Finalmente, Villarreal Beltrán expresó dudas sobre la independencia de la nueva Corte, especialmente en relación con los intereses del poder ejecutivo y la agenda política de Morena, sugiriendo que el verdadero test será su manejo de temas críticos como la militarización del país.",626458
406,2025-06-03,El Universal (sitio),¿Por qué el gobierno no actúa ante el huachicoleo en la CFE?,"Una de las banderas del gobierno de Andrés Manuel López Obrador y ahora de la presidenta Claudia Sheinbaum, fue el combate a la corrupción. El expresidente decía que la corrupción, como las escaleras, se debe barrer de arriba hacia abajo. Esto es, se debe iniciar con altos funcionarios que se hayan beneficiado del dinero público y lo utilicen en su beneficio. Después de 7 años en el poder, esta promesa dista mucho de haberse cumplido a cabalidad. Muestra de ello son las alianzas que han realizado con personajes como Pedro Haces de la CATEM, o con los líderes charros de los sindicatos corporativos de la CTM, FSTSE, SNTE, STPRM, de triste historia en el sindicalismo mexicano y que han jugado el papel de control y sometimiento de los trabajadores en México.",757666
408,2025-06-03,Reforma.com (sitio),Avanza el cómputo 18.94% en dos días,"Con 3 mil 504 hojas de operaciones capturadas de la elección judicial hasta las 21:24 horas, el Instituto Electoral de la Ciudad de México (IECM) registraba un avance del 18.94 por ciento.",8200000
409,2025-06-03,La Razón ES (Sitio),"Amaya Mendikoetxea, reelegida rectora de la Universidad Autónoma de Madrid","Amaya Mendikoetxea ha sido elegida rectora de la Universidad Autónoma de Madrid (UAM), tras obtener el mayor número de votos ponderados en las elecciones celebradas ayer lunes. La catedrática de Lingüística Inglesa ha obtenido casi el 59% de los votos ponderados (58,73%), mientras que el catedrático de Teoría de la Señal y Comunicaciones Javier Ortega ha obtenido el 41,2%, según los datos provisionales.",4000
414,2025-06-03,Poder EDO.MEX (sitio),Finalistas del Premio INBAL-UAM 2024 reafirman la potencia de la danza contemporánea,"El escenario del Teatro Casa de la Paz, espacio emblemático de la Universidad Autónoma Metropolitana (UAM), fue testigo de una noche de gran intensidad artística con la presentación de dos piezas finalistas del Premio INBAL-UAM de Danza Contemporánea 2024: Apéndice de Producciones La Lágrima y Ocre: La línea ha muerto.",15000
