,Fecha,Medio,Título,Resumen,Alcance
645,2025-05-29,La Jornada (sitio),"UAM, la segunda mejor universidad pública de México, reporta","Ciudad de México. La Universidad Autónoma Metropolitana (UAM) reportó que de acuerdo con AD Scientific 2025, la casa de estudios fue reconocida como la segunda mejor universidad pública de México.Este es el más reciente Ranking de Científicos y Universidades del Mundo 2025, que evalúa el impacto de la investigación académica y la calidad del trabajo de científicos en diferentes disciplinas.En primer lugar, se ubicó la Universidad Nacional Autónoma de México (UNAM), según el reporte que clasifica instituciones y científicos a nivel global y regional, considerando diversas áreas del saber como Ciencias Médicas y de la Salud, Ingeniería y Tecnología, Ciencias Sociales, Artes y Humanidades, entre otras.Desde su fundación, la UAM ha mantenido un compromiso inquebrantable con la generación de conocimiento y la formación de investigadores altamente capacitados. La Universidad cuenta con unidades académicas y centros de investigación que impulsan estudios en sectores estratégicos como medio ambiente, salud, tecnología, desarrollo urbano y educación, consolidando su prestigio tanto a nivel nacional como internacional.""Uno de los factores determinantes que han permitido que la Casa abierta al tiempo alcance esta posición privilegiada es su capacidad para vincular la investigación con la solución de problemas reales, mediante iniciativas interdisciplinarias y alianzas estratégicas con diversas instituciones y organismos, los científicos de la UAM trabajan en el desarrollo de proyectos de alto impacto que contribuyen directamente a la transformación social"", señaló.La clasificación evalúa a científicos de todo el mundo mediante un análisis detallado de sus publicaciones y el impacto de sus trabajos en la comunidad académica global. Gracias a la solidez de sus aportaciones científicas, los investigadores de la UAM han logrado colocarse entre los más destacados, reflejando la calidad de la indagación que se produce dentro de la universidad.El reconocimiento de la UAM en el AD Scientific Index 2025 reafirma su papel como líder en investigación y producción científica en México. Su posición en el ranking resalta la calidad y el rigor de su trabajo académico y también la consolida como una institución clave en la generación de conocimiento y la formación de especialistas en diversas disciplinas.Este logro subraya la importancia de seguir fomentando la investigación en la nación y fortalecer los vínculos entre universidades y centros científicos para impulsar la innovación y el desarrollo; por ello, la UAM, con su modelo educativo y su compromiso con la excelencia, continúa demostrando que la producción de conocimiento es una herramienta fundamental para la transformación social y la construcción de un mejor futuro.El AD Scientific Index es un sistema de clasificación global basado en productividad e impacto científico, ha publicado oficialmente las clasificaciones de 2025 para México. Esta evaluación exhaustiva cubre a cientos de universidades e instituciones y a miles de investigadores en todo el país.Después de la UAM se ubicaron el Instituto Politécnico Nacional, Universidad de Guadalajara, Universidad Autónoma de San Luis Potosí, Colegio de Postgraduados, Universidad Autónoma del Estado de México, Universidad Autónoma del Estado de Morelos, Universidad de Guanajuato y El Colegio de la Frontera Sur.El AD Scientific Index analiza datos de perfiles públicos de Google Scholar para evaluar a científicos e instituciones de todo el mundo. Cubre más de 2.63 millones de investigadores, 24 600+ instituciones y 211 disciplinas en 221 naciones, ofreciendo una visión multidimensional del desempeño académico global.",1290000
647,2025-05-29,México-times CDMX (sitio),"UAM, la segunda mejor universidad pública de México, reporta","Ciudad de México. La Universidad Autónoma Metropolitana (UAM) reportó que de acuerdo con AD Scientific 2025, la casa de estudios fue reconocida como la segunda mejor universidad pública de México.",10800
648,2025-05-29,La Crónica de Hoy (sitio),UAM invita al último día de exposición de Personalidades desubicadas: estéticas de la coerción,"Una colección de obras que presentan la relación entre el control, la resistencia y la disolución de los límites entre quienes dominan y quienes son sometidos",312000
649,2025-05-29,La Crónica de Hoy (sitio),"UAM, la segunda mejor universidad pública de México","En el Ranking de Científicos y Universidades del Mundo 2025, se destacó que el modelo educativo de la UAM, impulsa la generación de saber en diversas disciplinas clave",312000
650,2025-05-29,UAM CDMX (Sitio),Aprueba la UAM creación de Especialización en Estudios de Discapacidad e Incidencia,El Colegio Académico autorizó la propuesta inicial proveniente de la División de Ciencias Sociales y Humanidades de la Unidad Xochimilco,4000
651,2025-05-29,Periodismo y Ambiente CDMX (sitio),Universidades deben consolidarse como espacios de esperanza y transformación social,"Las universidades desempeñan un papel esencial en la construcción de sociedades más equitativas y en la producción de conocimiento que responde a los desafíos globales; en un contexto caracterizado por el cambio climático, la polarización social y la evolución de los mercados laborales, estas instituciones tienen la responsabilidad de formar ciudadanos críticos y comprometidos con la transformación de su entorno.",17500
652,2025-05-29,Yahoo Noticias MX (sitio),Inteligencia Artificial en las aulas: el futuro ya empezó (pero no todos están invitados),"Levante la mano quien odió las matemáticas cuando era estudiante. Bueno, eso podría cambiar gracias a la Inteligencia Artificial. Y sí, estamos hablando de México, donde, según la prueba PLANEA, solo el 16% de los alumnos de secundaria alcanza un nivel satisfactorio en matemáticas. El Tec de Monterrey tiene una amplia oferta de cursos y una maestría en Inteligencia Artificial Aplicada.",1020000
655,2025-05-29,El Economista (sitio),Pase UAM ¿A qué carreras y planteles podrán acceder los egresados del Colegio de Bachilleres?,"Para el trimestre 2025 Otoño, que inicia en el mes de octubre, la Universidad Autónoma Metropolitana (UAM) recibirá a un mayor número de estudiantes que egresen del Colegio de Bachilleres como parte del programa ""Pase UAM"".",318000
656,2025-05-29,El Economista (sitio),Inteligencia Artificial en las aulas: el futuro ya empezó (pero no todos están invitados),"Levante la mano quien odió las matemáticas cuando era estudiante. Bueno, eso podría cambiar gracias a la Inteligencia Artificial. Y sí, estamos hablando de México, donde, según la prueba PLANEA, solo el 16% de los alumnos de secundaria alcanza un nivel satisfactorio en matemáticas.",318000
657,2025-05-29,La Silla Rota (sitio),UNAM y Poli: estas son las carreras que no deberías elegir; tienes menos posibilidades de quedarte,"La elección de una carrera universitaria es, para miles de jóvenes, una de las decisiones más importantes de su vida. No solo define el rumbo profesional, sino también influye en el desarrollo personal, económico y social de quien la elige.",383000
658,2025-05-29,Canal 20 TV TAMP (sitio),"Invita la UAT a estudiar la carrera de seguridad, salud y medio ambiente","« · El programa que imparte la UAM Matamoros forma profesionales expertos en la prevención de riesgos, la seguridad e higiene laboral y la normativa ambiental, para desempeñarse en los sectores industrial, empresarial y de servicios, además de organismos públicos e instituciones de salud y educación. «",742
659,2025-05-29,Reforma.com (sitio),Talarán mil 22 árboles en Cerro de la Estrella,"De 70 mil árboles que se encuentran en el Cerro de la Estrella, mil 22 serán retirados debido a que están muertos en pie y representan un riesgo ante la posibilidad de que caigan sobre visitantes y corredores.",8200000
663,2025-05-29,Voz Populí ES (Sitio),Esta es la nota de corte para estudiar Enfermería en Madrid,"En un contexto donde la escasez de personal sanitario en Europa es una preocupación creciente, la carrera de Enfermería se posiciona como una de las más demandadas y con mejor inserción laboral en España. Según la OCDE, faltan aproximadamente 1,2 millones de médicos, enfermeros y matronas en la región europea, lo que ha llevado a una creciente necesidad de profesionales en el sector sanitario.",188000
664,2025-05-29,TV. Azteca MX (sitio),Pase UAM 2025: Conoce la lista de las carreras con más lugares para los estudiantes,Descubre cuáles son las carreras de la UAM con más lugares para el Pase Directo 2025. Y conoce las fechas claves de este acceso a la educación superior.,55000
665,2025-05-28,UAM CDMX (Sitio),Las universidades deben consolidarse como espacios de esperanza y transformación social,Número 310,4000
666,2025-05-28,Ibero 90.9 (Sitio),"Universidades, Agentes de Esperanza y Cambio, Coinciden IBERO, UP y UAM",Autoridades de las tres universidades coinciden en que las instituciones deben asumir un rol protagónico ante los desafíos globales,15000
667,2025-05-28,DEPOR Medio Tiempo,¡Atención! Estas dos carreras NO entrarán en el Pase UAM 2025; conoce cuáles puedes elegir,"A pesar de que pueden elegir 57 licenciaturas, los estudiantes de COLBACH que apliquen el Pase UAM 2025 no podrán elegir estas dos carreras por esta razón.",402000
668,2025-05-28,Monitoreo Especial 8,"La UAM inauguró la especialización en Medios Públicos, Creatividad e Innovación en Cuajimalpa y Xochimilco.","La Universidad Autónoma Metropolitana (UAM) ha inaugurado la especialización en Medios Públicos, Creatividad e Innovación, un posgrado que se impartirá en las unidades Cuajimalpa y Xochimilco. 
 
 La Secretaria General del Awam, Norma Rondero López, destacó que este programa, con una duración de tres trimestres, está diseñado para formar profesionales capaces de generar contenidos con responsabilidad social y compromiso democrático. 
 
 Rondero López subrayó la importancia de fortalecer los medios públicos a través de propuestas innovadoras y socialmente relevantes, en un momento crucial para la Comunicación en el país.",25000
669,2025-05-28,Quadratín México (sitio),Pueblo distinguirá quienes buscan transformar al PJ: Ana María Ibarra,"CIUDAD DE MÉXICO, 28 de mayo de 2025.- En la recta final de su campaña, la candidata a Ministra de la Suprema Corte de Justicia de la Nación (SCJN) Ana María Ibarra Olguín convocó a las y los estudiantes de la Universidad Autónoma Metropolitana (UAM), Unidad Cuajimalpa, a participar activamente en la elección del próximo 1 de junio.",141000
670,2025-05-28,COMECSO (Sitio),"Estado, política y reciprocidad","Universidad Nacional Autónoma de México, Centro Peninsular en Humanidades y Ciencias Sociales",4000
671,2025-05-28,Milenio (sitio),"Director de CCH Naucalpan renuncia a su cargo ""por motivos personales""","El lunes 26 de mayo, el director del Colegio de Ciencias y Humanidades (CCH) plantel Naucalpan, Keshava Rolando Quintanar Cano, presentó su renuncia al cargo por motivos personales.",199654
672,2025-05-28,Quadratín SLP (Sitio),Por concluir construcción de nueva Unidad Administrativa en Soledad,"SAN LUIS POTOSÍ, SLP., 28 de mayo de 2025.-De acuerdo con el alcalde de Soledad de Graciano Sánchez, Juan Manuel Navarro Muñiz, la construcción de la nueva Unidad Administrativa Municipal (UAM) registra un progreso del 90 por ciento.",25400
673,2025-05-28,Gaceta UNAM CDMX (sitio),Histórica Jornada de Debate Estudiantil Interuniversitario,"Se celebró la Jornada de Debate Estudiantil Interuniversitario para reflexionar entre jóvenes de cuatro universidades públicas de la Ciudad de México: la Universidad Autónoma Metropolitana, campus Xochimilco, la Universidad Autónoma de la Ciudad de México (UACM), la Universidad Nacional Rosario Castellanos y la Universidad Nacional Autónoma de México (UNAM), sobre la elección de jueces y magistrados del Poder Judicial de la Federación.",3070
674,2025-05-28,Chilango (sitio),¿Qué árboles se dan en la CDMX? Descúbrelo en estos recorridos,"La CDMX está llena de árboles de todas formas y tamaños, pero ¿sabes cuáles son y cómo reconocerlos? Una forma diferente y divertida de conocerlos es con los recorridos guiados que organiza Francisco Arjona, ingeniero ambiental egresado de la UAM Azcapotzalco.",114000
675,2025-05-28,JLA Noticias CDMX (Sitio),¿Qué árboles se dan en la CDMX? Descúbrelo en estos recorridos,"La CDMX está llena de árboles de todas formas y tamaños, pero ¿sabes cuáles son y cómo reconocerlos? Una forma diferente y divertida de conocerlos es con los recorridos guiados que organiza Francisco Arjona, ingeniero ambiental egresado de la UAM Azcapotzalco.",18200
676,2025-05-28,Periódico Contacto TAMP (Sitio),"Invita la UAT a estudiar la carrera de seguridad, salud y medio ambiente","El programa que imparte la UAM Matamoros forma profesionales expertos en la prevención de riesgos, la seguridad e higiene laboral y la normativa ambiental, para desempeñarse en los sectores industrial, empresarial y de servicios, además de organismos públicos e instituciones de salud y educación.",40
677,2025-05-28,Periódico Contacto TAMP (Sitio),A MI MANERA,Por Tello Montes,40
678,2025-05-28,Expreso on line TAMPS (sitio),"Invita la UAT a estudiar la carrera de seguridad, salud y medio ambiente","CIUDAD VICTORIA, TAMAULIPAS.- El programa que imparte la UAM Matamoros forma profesionales expertos en la prevención de riesgos, la seguridad e higiene laboral y la normativa ambiental, para desempeñarse en los sectores industrial, empresarial y de servicios, además de organismos públicos e instituciones de salud y educación.",334590
686,2025-05-28,Diario Basta (Sitio),Cuesta 1.8 mdp mantener al Estadio Puma,"Aunque la venta de boletos de equipos de la Liga MX debe destinarse a algunas acciones, el mantenimiento lo destina la UNAM con dinero del presupuesto asignado anual",70200
687,2025-05-28,El Gráfico (Sitio),MetroCDMX: ¿Hay retrasos HOY miércoles 28 de mayo?,"Desde las primeras horas en que el Metro CDMX inició operaciones, usuarios han reportado retrasos de hasta 15 minutos en algunas estaciones.",291000
688,2025-05-28,Desinformemonos.org CDMX (sitio),Que veinte años no es nada...,"Hace 20 años supe por primera vez lo que era la desaparición forzada y el asesinato de una persona que denuncia la injusticia. El papá de mi amiga Adriana, con la que compartía el taller literario ""Tablero"" en una biblioteca pública en Colima, fue desaparecido tras salir de la casa de mi padre en donde presentó, frente a colegas y amigos, un libro que denunciaba la extracción minera ilegal en Colima. Poco tiempo después se confirmó el hallazgo de su cuerpo. Quiero dar fe de que a mis casi veinte años de edad me enteré de que a un hombre que tuvo la valentía de denunciar una empresa de muerte se le arrancó la vida en total impunidad, me enteré de que eso era posible en el mundo que me rodeaba.",34100
690,2025-05-28,El Norte NL (sitio),Universidades mexicanas se unen a favor de la sostenibilidad,Veintiún universidades públicas y privadas en territorio nacional reafirmaron su compromiso a favor de la sostenibilidad y movilizar la acción climática en el País tras firmar una declaratoria nacional durante la Cumbre de Rectoras y Rectores de Universidades Mexicanas por la Acción Climática 2025.,7600000
691,2025-05-28,Hoja de Ruta (Sitio),"Importante fortalecer vinculación entre Sistema Nacional de Ciencia, Humanidades, Tecnología e Innovación y de Educación Superior: Secihti en Conaces","Secretaria Rosaura Ruiz participó en Conaces, órgano colegiado de deliberación y consenso que tiene como objetivo acordar acciones que impulsen la educación superior en México
 Ante autoridades educativas del país, la titular de Secihti señaló la importancia de convocar a este Consejo también a instancias responsables de ciencia y tecnología de las entidades federativas
 Educación de posgrado tiene retos en el tamaño de matrícula y distribución en áreas del conocimiento
 Anunció que, en conjunto con la SEP, se ha iniciado un proceso de revisión del actual Sistema Nacional de Posgrados; se harán seis foros regionales para su discusión",67000
692,2025-05-28,CNT Tamaulipas TAMP(Sitio),Elección: Tómbola judicial,-AVA y SEMAR refuerzan la paz y aceleran el Puerto del Norte en Matamoros.,35600
693,2025-05-28,Posta CDMX (Sitio),Metro CDMX: estas son las líneas con más afectaciones este 28 de mayo,"El Metro CDMX es la columna vertebral de la movilidad para los capitalinos, por eso es normal que cuando presente fallas o retrasos en el servicio, como suele ocurrir durante la temporada de lluvias, sea un grave problema para los millones de usuarios que diariamente lo utilizan.",216600
695,2025-05-28,EdoMex 101.3 Ultra,Análisis de la situación en la UAEMEX (Parte 2).,"En mesa de análisis Claudia Hidalgo, periodista, Gerardo Carmona, jefe de información de La Jornada y de Epígrafe y Francisco Ledezma, colaborador de Plana Mayor y Paul Valdez, investigador, hablaron de la situación en la UAEMEX. 
 
 En la Universidad Autónoma el paro estudiantil persiste, evidenciando la falta de avances en las negociaciones. 
 
 El encargado del despacho, quien se presentará en la sesión del Consejo Universitario del 30 de mayo, enfrenta críticas por no establecer acuerdos claros con los estudiantes. 
 
 Mientras tanto, asambleas de personal administrativo y docente emergen, demandando atención a sus necesidades. 
 
 La falta de voluntad política y la ausencia de propuestas concretas por parte de la rectoría agravan la situación. 
 
 Se sugiere la necesidad de una reforma progresiva en la universidad para abordar las demandas estudiantiles, evitando así un posible estancamiento o anarquía. 
 
 La falta de transparencia y comunicación efectiva entre la rectoría y la comunidad universitaria se destaca como un obstáculo para la resolución del conflicto.",70000
696,2025-05-28,La Silla Rota (sitio),UNAM y Poli: estas son las carreras que sí deben elegir las mujeres; tienen más beneficios,"En el panorama educativo de México, dos instituciones se han consolidado como referentes: la Universidad Nacional Autónoma de México (UNAM) y el Instituto Politécnico Nacional (IPN). Ambas casas de estudio representan motores de desarrollo científico, tecnológico y cultural del país.",383000
697,2025-05-28,Hoja de Ruta (Sitio),"Importante fortalecer vinculación entre Sistema Nacional de Ciencia, Humanidades, Tecnología e Innovación y de Educación Superior: Secihti en Conaces","En el marco de la decimoquinta sesión ordinaria del Consejo Nacional para la Coordinación de la Educación Superior (Conaces) órgano colegiado coordinado por la Secretaría de Educación Pública (SEP), realizada en la sede de la Asociación Nacional de Universidades e Instituciones de Educación Superior (ANUIES), la secretaria de Ciencia, Humanidades, Tecnología e Innovación (Secihti), Rosaura Ruiz Gutiérrez, planteó la fundamental vinculación entre la ciencia, la tecnología y la educación superior.",67000
700,2025-05-28,Info Radio 23 TV TAMPS (sitio),Halcones UAMVH-UAT van a Nacional de Softbol de Educación,PACO GALINDO/ www.inforadio-test.com/,4000
702,2025-05-28,EDT Estado del Tiempo MX (sitio),RTP moviliza a más de 240 mil estudiantes con Sendero Seguro en 2025,"Ciudad de México.- Durante los primeros cuatro meses de 2025, la Red de Transporte de Pasajeros (RTP) de la Ciudad de México ha logrado trasladar de manera segura, económica y eficiente a 242,242 estudiantes de nivel medio superior y superior a través del programa Sendero Seguro. Esta iniciativa tiene como objetivo proporcionar una alternativa de transporte que resguarde la integridad de miles de jóvenes, especialmente durante horarios extraordinarios y trayectos estratégicos.",10100
703,2025-05-28,Julio Astillero (sitio),Gobierno de Sheinbaum no ha encontrado alternativas al actual modelo de pensiones: investigador (por Isaac Rosales de Astillero Informa),"El expresidente López Obrador tampoco se deshizo de la ""herencia neoliberal"" en materia de pensiones.",9600
704,2025-05-27,La Silla Rota (sitio),UNAM y Poli: estas son las carreras que sí deben elegir las mujeres; tienen más beneficios,"En el panorama educativo de México, dos instituciones se han consolidado como referentes: la Universidad Nacional Autónoma de México (UNAM) y el Instituto Politécnico Nacional (IPN). Ambas casas de estudio representan motores de desarrollo científico, tecnológico y cultural del país.",383000
705,2025-05-27,Alcanzando El Conocimiento CDMX (Sitio),"Importante fortalecer vinculación entre Sistema Nacional de Ciencia, Humanidades, Tecnología e Innovación y de Educación Superior: Secihti en Conaces","En el marco de la decimoquinta sesión ordinaria del Consejo Nacional para la Coordinación de la Educación Superior (Conaces) órgano colegiado coordinado por la Secretaría de Educación Pública (SEP), realizada en la sede de la Asociación Nacional de Universidades e Instituciones de Educación Superior (ANUIES), la secretaria de Ciencia, Humanidades, Tecnología e Innovación (Secihti), Rosaura Ruiz Gutiérrez, planteó la fundamental vinculación entre la ciencia, la tecnología y la educación superior.",4000
706,2025-05-27,UAM CDMX (Sitio),Rinden homenaje a María Ana Portal por su legado a la Antropología Social,Número 306,4000
707,2025-05-27,El Heraldo de México (sitio),Coinciden autoridades educativas en el papel transformador de las universidades,"Durante la puesta en marcha de la Iniciativa para la Diplomacia Cultural en América del Norte, José Antonio de los Reyes Heredia, rector general de la Universidad Autónoma Metropolitana, señaló que la UAM ha fomentado el pensamiento crítico respecto a las problemáticas actuales, como la violencia y el cambio climático.",1674420
708,2025-05-27,Noticias MVS (Sitio),Convocatoria UAM 2025: estas son las carreras que NO tienen pase directo de Bachilleres,"La UAM lanzó su convocatoria 2025 con pase directo para alumnos de Bachilleres, pero no todas las carreras participan. Aquí los detalles.",558000
709,2025-05-27,Nota Tamaulipas TAMPS (sitio),Elección: Tómbola judicial,"A MI MANERAPor Tello Montes-AVA y SEMAR refuerzan la paz y aceleran el Puerto del Norte en Matamoros.-Abre UAT Matamoros registro para estudiar Seguridad, Salud y Medio Ambiente",18600
710,2025-05-27,Monitoreo Especial,Semana de eventos académicos en la UAM,"Una semana de eventos académicos se vivió en la Universidad Arturo Michelena (UAM), para impulsar el conocimiento y la innovación.",15000
711,2025-05-27,Hoy Tamaulipas TAMPS (sitio),Elección: Tómbola judicial,-AVA y SEMAR refuerzan la paz y aceleran el Puerto del Norte en Matamoros.,361600
712,2025-05-27,Valle del Norte TAMPS (sitio),"Invita la UAT a estudiar la carrera de seguridad, salud y medio ambiente","° El programa que imparte la UAM Matamoros forma profesionales expertos en la prevención de riesgos, la seguridad e higiene laboral y la normativa ambiental, para desempeñarse en los sectores industrial, empresarial y de servicios, además de organismos públicos e instituciones de salud y educación._",31
713,2025-05-27,Mi Bolsillo SIN (Sitio),"La mejor universidad de México no es la UNAM ni el IPN, revela ranking global","Cada año, el ranking QS World University Rankings, elaborado por la firma británica Quacquarelli Symonds, se convierte en una referencia clave para evaluar el desempeño de instituciones de educación superior a nivel mundial.",2470
714,2025-05-27,El Sur GRO (sitio),Universidades mexicanas se unen a favor de la sostenibilidad,"Ciudad de México, 27 de mayo de 2025.- Veintiún universidades públicas y privadas en territorio nacional reafirmaron su compromiso a favor de la sostenibilidad y movilizar la acción climática en el País tras firmar una declaratoria nacional durante la Cumbre de Rectoras y Rectores de Universidades Mexicanas por la Acción Climática 2025.",63980
715,2025-05-27,El Universal (sitio),RTP ha movilizado más de 242 mil estudiantes a través del programa Sendero Seguro; estas son las escuelas beneficiadas,"El programa brinda una tarifa especial al mostrar una identificación escolar especial, además de seguridad durante el trayecto",757666
716,2025-05-27,Infobae América (Sitio),Pase UAM 2025: cuáles son las licenciaturas que no participan en el proceso,Quienes concluyen sexto semestre en el Colegio de Bachilleres podrán acceder a este proceso,1120000
717,2025-05-27,La Silla Rota (sitio),UNAM y Poli: estas son las carreras que sí deben elegir las mujeres; tienen más beneficio,"En el panorama educativo de México, dos instituciones se han consolidado como referentes: la Universidad Nacional Autónoma de México (UNAM) y el Instituto Politécnico Nacional (IPN). Ambas casas de estudio representan motores de desarrollo científico, tecnológico y cultural del país.",383000
718,2025-05-27,Excélsior (Sitio),"¿Fan de los ajolotes? Invitan a recorrido guiado en Desierto de los Leones, CDMX","La Secretaría del Medio Ambiente de la Ciudad de México invitó a conocer al ajolote de arroyo de montaña en el Parque Nacional Desierto de los Leones, a través de un recorrido guiado.",19300000
719,2025-05-27,Generación Universitaria CDMX (sitio),Pase UAM: lista de licenciaturas que no tienen pase automático el Bachilleres,"El 2025 trae excelentes noticias para todos los estudiantes de nivel medio superior pertenecientes al Colegio de Bachilleres, pues podrán estudiar en la Universidad Autónoma Metropolitana(UAM) sin hacer examen.",196200
